id,title,content,published_at,source_url,category
222,Why a power struggle has broken out over Kirkuk,"<p><strong>JUDY WOODRUFF:</strong> Longstanding rivalries were re-ignited in Iraq today between vital American allies.</p>
<p>Iraqi military forces and militia moved to push Kurdish forces out of the disputed city of Kirkuk in the country&#8217;s north.</p>
<p>Lisa Desjardins begins our coverage.</p>
<p><strong>MAN</strong> (through interpreter): The commander in chief of the armed forces, Dr. Haider al-Abadi, gave orders to protect the people of Kirkuk and to impose security in the city.</p>
<p><strong>LISA DESJARDINS:</strong> After months of simmering tensions, Iraqi federal troops moved to retake the disputed city of Kirkuk from Kurdish forces.</p>
<p>The effort launched before dawn. By midday, Iraqi soldiers, along with state-backed militias, quickly took control of several massive oil fields north of the city. Iraqis also captured Kirkuk&#8217;s military airport and various government buildings. They lowered what had been a symbolic Kurdish flag at the governor&#8217;s compound.</p>
<p>Journalist Rebecca Collard in Irbil was in Kirkuk this morning.</p>
<p><strong>REBECCA COLLARD,</strong> Journalist: You could hear some clashes, some gunfire in the distance, but for the most part, the city seemed more or less abandoned. Now, the Iraqi army, by the end of today, was essentially in control of the whole city and many of the outskirts of Kirkuk.</p>
<p><strong>LISA DESJARDINS:</strong> The spokesman for an Iraqi Shiite militia said they achieved all their goals with little resistance.</p>
<p><strong>AHMED AL-ASSADI, </strong> Spokesman for al-Hashed al-Shaabi (through translator): As the troops approached the area, they were confronted by some rebels, who tried to hinder the progress of the advancing units. Our troops returned fire and silenced its source.</p>
<p><strong>LISA DESJARDINS:</strong> This comes three weeks after the Kurds held a nonbinding independence referendum that included the disputed province of Kirkuk.</p>
<p>More than 90 percent of the Kurdish region&#8217;s residents voted to split from Iraq. The Iraqi federal government, Turkey, Iran and the U.S. all rejected the independence drive.</p>
<p>The multiethnic region of Kirkuk lies just outside of the autonomous Kurdish region in Iraq&#8217;s north. Called the country&#8217;s oil capital, Kirkuk produces around 500,000 barrels a day.</p>
<p>In 2014, amid the ISIS onslaught across Northern Iraq, the Kurds took control of Kirkuk, as the Iraqi military fled the city. In the three years since, the Kurds, led by their president, Massoud Barzani, sought to cement their hold, despite tensions with the central government.</p>
<p>Today, Kurdish officials accused Iraq of carrying out a major multipronged attack.</p>
<p><strong>MAJ. GEN. AYOUB YUSUF SAID,</strong> Peshmerga Commander (through interpreter): I don&#8217;t know what is happening exactly, because we have been in this fight since 4:00 in the morning. We have suffered casualties, including martyrs, and now we have withdrawn to this position. Some of the other Kurdish forces have pulled out. They didn&#8217;t fire a single shot.</p>
<p><strong>LISA DESJARDINS:</strong> While Kurdish forces withdrew from posts south of the city, some residents vowed to die fighting. Thousands of others fled north.</p>
<p><strong>REBECCA COLLARD:</strong> For the last few years, the Iraqi forces, these primarily Shia militia, the Hashed Shaabi, and the Kurdish forces have been focused on fighting ISIS. Now that fight is coming to an end, and what the fear is that now these internal division in Iraq are going to become more apparent and possibly more violent.</p>
<p><strong>LISA DESJARDINS:</strong> These clashes pit one substantially American-armed military force against another. Both the Kurdish forces and Iraqi government troops are part of the coalition fighting ISIS. The U.S. sought to downplay the fighting, labeling the exchange of gunfire a misunderstanding.</p>
<p>And, in the Rose Garden, President Trump tried to stay neutral.</p>
<p><strong>PRESIDENT DONALD TRUMP:</strong> We don&#8217;t like the fact that they&#8217;re clashing. We&#8217;re not taking sides. But we don&#8217;t like the fact that they&#8217;re clashing.</p>
<p><strong>LISA DESJARDINS:</strong> For the PBS NewsHour, I&#8217;m Lisa Desjardins.</p>
<p><strong>JUDY WOODRUFF:</strong> For more, I&#8217;m joined now by Emma Sky. She served as an adviser to General David Petraeus while he was commander of U.S. forces in Iraq from 2007 to 2010, and by Feisal Istrabadi. He&#8217;s a former Iraqi ambassador to the United Nations and he helped write Iraq&#8217;s interim constitution.</p>
<p>Welcome to both of you.</p>
<p>Let me start with you, Emma Sky.</p>
<p>This has happened so quickly. What exactly has the Iraqi government done?</p>
<p><strong>EMMA SKY,</strong> Yale University: The Iraqi government has deployed its forces back up north into Kirkuk.</p>
<p>And since 2003, the Kurds have made it clear that they want to include Kirkuk within their territory in order to proceed with gaining independence, which has always been their goal. But Kirkuk is important to Iraq itself, and no Iraqi prime minister can afford to lose Kirkuk.</p>
<p>So you can see this reaction that has taken place following the referendum on independence, which happened September the 25th, and also included the disputed territories and the city of Kirkuk.</p>
<p><strong>JUDY WOODRUFF:</strong> Feisal Istrabadi, what can you add to why the Iraqi government is so set on taking over the city?</p>
<p><strong>FEISAL ISTRABADI,</strong> Former Deputy UN Ambassador, Iraq: Well, a couple of reasons.</p>
<p>First, as Emma just said, it is a part of the disputed territories, which are legally and constitutionally under the jurisdiction of the federal government in Baghdad. The KRG expanded into these disputed territories at the time when ISIL was expanding its territory, and then began to take steps to unilaterally declare that these areas were now incorporated into the Kurdistan region, including when it held the referendum that Emma talked about.</p>
<p>It included holding the referendum in these disputed territories. Now, so long as Iraq &#8212; so long as we&#8217;re talking about a single country, it matters a little less who controls Kirkuk, but once the referendum was held, this gave rise then to the second reason for Baghdad choosing to act now.</p>
<p>As Emma said, Kirkuk is an important oil-producing zone in Iraq. And it is vital for the economic viability of an independent Kurdish state and an important part of the economic viability of the Iraqi state. So there was never going to be a scenario, I think, in which Baghdad would allow a unilateral exercise of control by Kurds to occur over Kirkuk, so long as independence is on the table.</p>
<p><strong>JUDY WOODRUFF:</strong> Emma Sky, we heard President Trump say today the U.S. is not taking sides in this.</p>
<p>Is that accurate, that the U.S. isn&#8217;t taking sides? What is the U.S. role here?</p>
<p><strong>EMMA SKY:</strong> Well, the U.S. has stipulated over and over again that its policy is to support a united Iraq.</p>
<p>So you can see the U.S. has given support to Iraqi security forces, but also to the Kurdish Peshmerga, to fight against ISIS. The U.S. policy for the last few years has really been focused on ISIS and not on the day after ISIS.</p>
<p>But what we&#8217;re witnessing at the moment is that different groups are already moving to the day after, which is the power struggle for control of different territories in Iraq.</p>
<p>And Barzani believed that during the fight against ISIS, he became stronger because he got weapons directly from the international community. And, as Feisal said, he was able to extend his control over the disputed territories.</p>
<p>He&#8217;s also facing domestic problems within Kurdistan. There are tensions between the different Kurdish groups, and some believe that Barzani has overstayed his term as president.</p>
<p><strong>JUDY WOODRUFF:</strong> Which reminds us just how complicated this is, Feisal Istrabadi.</p>
<p>What does the Iraqi central government want here? They&#8217;re not going to get rid of the Kurds. What is it that they want?</p>
<p><strong>FEISAL ISTRABADI:</strong> Oh, well, I mean, the Kurds of course are a vital part of Iraq. They&#8217;re a vital part of the political process, and they have been represented in Baghdad. The president of Iraq is a Kurd and has been since 2005.</p>
<p>I think what needs to occur and I hope what the government of Iraq wants is a negotiated settlement, in which no party dictates terms to the other, but a negotiated settlement.</p>
<p>Look, Irbil has some legitimate agreements with respect to Baghdad. Baghdad has some legitimate agreements with respect to Irbil. I think we need a mediator perhaps or somebody to convene a roundtable &#8212; the United States is who I&#8217;m thinking of, of course &#8212; to address some of those issues.</p>
<p>Most of the issues are, from the Irbil side, economic issues of payments, and from Baghdad&#8217;s side, transparency of how much oil Irbil is producing and exporting, which Irbil has never accounted for to Baghdad.</p>
<p>I think if those issues are resolved, perhaps hopefully some of these other issues can at least be delayed for another day. But at the end of the day, neither government &#8212; neither the regional government nor the federal government in Baghdad can really tolerate dictation of terms to it by the other side. My hope is that a negotiated settlement obtains.</p>
<p><strong>JUDY WOODRUFF:</strong> Emma Sky, where do you see this going from here? Do you see the peace that different sides have worked to hard to create in Iraq unraveling as a result of this?</p>
<p><strong>EMMA SKY:</strong> I think there is an opportunity for a deal, and I think the sort of deal that could be negotiated is one that looks at a special status for the city of Kirkuk and negotiated terms for Kurdistan&#8217;s separate, whether that be towards confederation or towards independence.</p>
<p>But there needs to be negotiation. There needs to be a look at where should the border between Iraqi Kurdistan and the rest of Iraq actually be, and that requires mediation district by district through those territories.</p>
<p><strong>JUDY WOODRUFF:</strong> Well, we know there are other players who are playing an important role here in Iran and Turkey, and this is all very much playing out as we watch, watch it happen in Iraq.</p>
<p>Emma Sky, Feisal Istrabadi, thank you very much.</p>
<p><strong>FEISAL ISTRABADI:</strong> Thank you.</p>
<p><strong>EMMA SKY:</strong> Thank you.</p>
<p>The post <a href=""http://www.pbs.org/newshour/bb/power-struggle-broken-kirkuk/"" rel=""nofollow"">Why a power struggle has broken out over Kirkuk</a> appeared first on <a href=""http://www.pbs.org/newshour"" rel=""nofollow"">PBS NewsHour</a>.</p>",,http://www.pbs.org/newshour/bb/power-struggle-broken-kirkuk/,Others
223,Rex Tillerson says continue diplomacy with North Korea ‘until first bomb drops’,"<div class=""wp-caption alignright"" id=""attachment_229698"" style=""width: 689px;""></div>
<p>WASHINGTON — Secretary of State Rex Tillerson says diplomatic efforts aimed at resolving the North Korean crisis &#8220;will continue until the first bomb drops.&#8221;</p>
<p>That statement comes despite President Donald Trump&#8217;s tweets a couple of weeks ago that his chief envoy was &#8220;wasting his time&#8221; trying to negotiate with &#8220;Little Rocket Man,&#8221; a mocking nickname Trump has given the nuclear-armed nation&#8217;s leader, Kim Jong Un.</p>
<p>&#8220;I think he does want to be clear with Kim Jong Un and that regime in North Korea that he has military preparations ready to go and he has those military options on the table. And we have spent substantial time actually perfecting those,&#8221; Tillerson told CNN&#8217;s &#8220;State of the Union&#8221; on Sunday. &#8220;But be clear: The president has also made clear to me that he wants this solved diplomatically. He&#8217;s not seeking to go to war.&#8221;</p>
<p>Recent mixed messaging from the top of the U.S. government has raised concerns about the potential for miscalculation amid the increasingly bellicose exchange of words by Trump and the North Korean leader.</p>
<p>Trump told the U.N. General Assembly last month that if the U.S. is &#8220;forced to defend itself or its allies, we will have no choice but to totally destroy North Korea.&#8221; Trump also tweeted that Korea&#8217;s leadership &#8220;won&#8217;t be around much longer&#8221; if it continued its provocations, a declaration that led the North&#8217;s foreign minister to assert that Trump had &#8220;declared war on our country.&#8221;</p>
<p>Tillerson acknowledged during a recent trip to Beijing that the Trump administration was keeping open direct channels of communications with North Korea and probing the North&#8217;s willingness to talk. He provided no elaboration about those channels or the substance of any discussions.</p>
<p>Soon after, Trump took to Twitter, saying he had told &#8220;our wonderful Secretary of State, that he is wasting his time trying to negotiate with Little Rocket Man &#8230; Save your energy Rex, we&#8217;ll do what has to be done!&#8221; Trump offered no further explanation, but he said all military options are on the table for dealing with North Korea&#8217;s nuclear and missile programs.</p>
<p>Analysts have speculated about whether the president and his top diplomat were playing &#8220;good cop, bad cop&#8221; with North Korea, and how China might interpret the confusing signals from Washington. Beijing is the North&#8217;s main trading partner, and the U.S. is counting on China to enforce U.N. sanctions.</p>
<p>&#8220;Rest assured that the Chinese are not confused in any way what the American policy towards North Korea (is) or what our actions and efforts are directed at,&#8221; Tillerson said.</p>
<p>Asked if Trump&#8217;s tweets undermined Tillerson, the secretary said: &#8220;I think what the president is doing is he&#8217;s trying to motivate action on a number of people&#8217;s part, in particular the regime in North Korea. I think he does want to be clear with Kim Jong Un and that regime in North Korea that he has military preparations ready to go and he has those military options on the table and we have spent substantial time perfecting those.&#8221;</p>
<p>He added that Trump &#8220;has made it clear to me to continue my diplomatic efforts, which we are, and I&#8217;ve told others those diplomatic efforts will continue until the first bomb drops.&#8221;</p>
<p>North Korea has launched missiles that potentially can strike the U.S. mainland and recently conducted its largest ever underground nuclear explosion. It has threatened to explode another nuclear bomb above the Pacific.</p>
<p>The post <a href=""http://www.pbs.org/newshour/rundown/rex-tillerson-says-continue-diplomacy-north-korea-first-bomb-drops/"" rel=""nofollow"">Rex Tillerson says continue diplomacy with North Korea &#8216;until first bomb drops&#8217;</a> appeared first on <a href=""http://www.pbs.org/newshour"" rel=""nofollow"">PBS NewsHour</a>.</p>",,http://www.pbs.org/newshour/rundown/rex-tillerson-says-continue-diplomacy-north-korea-first-bomb-drops/,Others
224,"Iraqi, Kurdish forces in standoff, weeks after Kurdish vote for independence","<p><strong>HARI SREENIVASAN:</strong> The desire of the Kurds along Iraq&#8217;s northern border to govern themselves is receiving more resistance from Iraq&#8217;s central government. Iraqi army forces are demanding Kurdish troops withdraw from oil fields and military bases around Kirkuk, a city in the Kurdistan region that voted for independence last month. Kirkuk also has 10% of Iraq&#8217;s known oil reserves. Washington Post&#8217;s Loveday Morris is in Baghdad covering this standoff joins me now via Skype. First of all the significance of this. Why is it so important?</p>
<p><strong>LOVEDAY MORRIS:</strong> There&#8217;s been a longtime conflict between Baghdad and Kurdistan over these disputed territories. Most significant of which is Kirkuk because of the oil reserves. But the referendum last month has really sharpened these disputes because you have Baghdad opposing independence and so it feels like they have to restate its territorial claims these areas. So that&#8217;s why we&#8217;re seeing a lot of tension right now. </p>
<p><strong>HARI SREENIVASAN:</strong> And just to give people a little bit of a brief timeline &#8211; Iraqi forces control this area for a while and then in June ISIS took over the area and now it&#8217;s kind of back in Kurdish hands?</p>
<p><strong>LOVEDAY MORRIS:</strong> Right. So in June 2014 Iraq lost control of a lot of the areas and we have this huge collapse in the face of an ISIS offensive. Over 100,000 soldiers fled and Kurdish forces moved in some of these areas &#8211; some of them maybe took from ISIS and others just moved into into the vacuum. And so Iraqi forces have been in these areas since June 2014. And that&#8217;s their main demand that they return to the areas. </p>
<p><strong>HARI SREENIVASAN:</strong> What&#8217;s the likelihood that this standoff right now turns violent? Into some sort of a civil war?</p>
<p><strong>LOVEDAY MORRIS:</strong>: I think at this point both sides don&#8217;t want violence. Al-Abadi, the prime minister, is really trying to defuse the situation by saying there&#8217;s going to be no  military attack. But at the same time there is this buildup of forces so that I think they are trying to, in a way, intimidate the Kurds to withdraw from some areas but they don&#8217;t want to see a fight per say. But in this really tense situation there can be a small spark and things can turn violent quite easily.</p>
<p><strong>HARI SREENIVASAN:</strong> Thank you. </p>
<p>The post <a href=""http://www.pbs.org/newshour/bb/iraqi-kurdish-forces-standoff-weeks-kurdish-vote-independence/"" rel=""nofollow"">Iraqi, Kurdish forces in standoff, weeks after Kurdish vote for independence</a> appeared first on <a href=""http://www.pbs.org/newshour"" rel=""nofollow"">PBS NewsHour</a>.</p>",,http://www.pbs.org/newshour/bb/iraqi-kurdish-forces-standoff-weeks-kurdish-vote-independence/,Others
225,South Sudan civil war causes Africa’s worst refugee crisis,"<p>The United Nations says South Sudan’s four-year-old civil war has left half of the nation’s population &#8212; 6 million people &#8212; in need of humanitarian aid. The conflict began when South Sudan’s army split between factions loyal to President Salva Kiir and former Vice President Riek Machar. The two men mobilized their respective tribes, the Dinka and the Nuer. The war has caused what is now one of the world’s worst refugee crises.</p>
<p><strong>SIMONA FOLTYN</strong>: Civil war is emptying huge swaths of South Sudan. The violence has uprooted four million people, including two million who’ve fled to neighboring countries. In the last year, more than a million South Sudanese have poured into northern Uganda alone, crossing makeshift bridges like this one to flee fighting, hunger, and brutal attacks on civilians.</p>
<p><strong>SEME LUPAI, REFUGE</strong>E: They started fighting very, very severely. So that made us to escape with our properties to this side.</p>
<p><strong>SIMONA FOLTYN</strong>: When Seme Lupai’s family went to one of the refugee camps, initially, he stayed behind to look after the family’s most precious commodity &#8212; their cattle. He hid for a year to escape the violence. The refugees carry whatever they can salvage &#8212; mattresses, pots, clothes, notebooks &#8212; remnants of once peaceful lives turned upside down. At checkpoints, Ugandan soldiers search their belongings for weapons, before the refugees proceed to reception centers. After entering Uganda, the refugees sign in at small waystations. For many, it’s the first night spent in safety after walking for days to escape fighting. Levi Arike fled with his wife and four children.</p>
<p><strong>LEVI ARIKE, REFUGEE</strong>: When the gunshots started, we laid under a tree with the whole family, because there was nowhere else to hide. We waited for the fighting to stop, and then we got up and started walking to Uganda.</p>
<p><strong>SIMONA FOLTYN</strong>: Uganda now shoulders most of the burden of Africa’s biggest refugee crisis, managing a constellation of camps which require food, water, healthcare, and policing. At Imvepi Camp, now home to more than 120,000 South Sudanese, new arrivals receive vaccinations, hot meals, and basic items such as soap and plastic tarps to build a house. The government also gives each refugee family a small plot of land, about a twentieth of an acre, where they can build a tent shelter and grow crops to eat or sell. But the land often proves too rocky for farming.</p>
<p><strong>SIMONA FOLTYN, IMVEPI REFUGEE CAMP, NORTHERN UGANDA</strong>: After completing the registration process, the new arrivals will receive their plot, to start a new life as refugees in Uganda. While they are safe here, there are many challenges ahead, not least processing the trauma of what they experienced back home.</p>
<p>This woman, who we’ll call “Agnes,” agreed to tell us about her harrowing experience. She says four government soldiers from President Salva Kiir’s Dinka tribe stopped her as she was fleeing South Sudan and raped her right in front of her family.</p>
<p><strong>AGNES</strong> (translated to English): When they started raping me, they told me not to raise alarm, otherwise they would shoot me. Still when I’m sleeping, I’m dreaming of the Dinka, that they are coming to rape me again.</p>
<p><strong>SIMONA FOLTYN</strong>: How often do you have those dreams?</p>
<p><strong>AGNES</strong>: Daily, every time I lie down, those dreams come.</p>
<p><strong>SIMONA FOLTYN</strong>: A recent Human Rights Watch report on South Sudan found “&#8230;a clear pattern of government forces unlawfully targeting civilians for killings, rapes, torture&#8230;and destruction of property..” The victims are from ethnic groups suspected to support the rebels.</p>
<p><strong>AGNES</strong>: They are doing it, because they know very well that those soldiers are our brothers. So they do it to punish them..</p>
<p><strong>SIMONA FOLTYN</strong>: Although the rebels, known as the Sudan People’s Liberation Army In Opposition, purport to protect local communities, there are also reports of their fighters assaulting civilians near the Ugandan border. Josephine Yanya told us she didn’t feel safe in the presence of either side’s soldiers. Her family and neighbors fled their village after government soldiers killed her uncle.</p>
<p>They hid in the mountains only to find themselves under attack again, this time by opposition fighters from the Nuer tribe loyal to former vice president Riek Machar. Yanya says ethnic Nuer soldiers from the SPLA-IO rebel group raped a member of her group and stole her father&#8217;s’ cattle.</p>
<p><strong>JOSEPHINE YANYA</strong> (translated to English): Before we were thinking that the rebels would protect us, but if they are lacking food, they just come and take things by force.</p>
<p><strong>SIMONA FOLTYN</strong>: With nowhere left to hide, Yanya fled to Uganda with her son.<br />
But instead of finding a place to rebuild their lives, they are in limbo. And aid groups don’t have enough food to distribute.</p>
<p><strong>JOSEPHINE YANYA</strong> (translated to English):We are getting small food rations. I know it won’t be enough even for one month.</p>
<p><strong>SIMONA FOLTYN</strong>: According to the United Nations, the international community has given less than a-third of the $1.4 billion dollars needed for the refugee response in South Sudan’s neighboring countries. These refugees foresee more hardship and have no idea when they might return home.</p>
<p><strong>JOSEPHINE YANYA</strong> (translated to English): I’m always praying for peace in South Sudan, and until then, I’ll just stay here.</p>
<p>The post <a href=""http://www.pbs.org/newshour/bb/south-sudan-civil-war-causes-africas-worst-refugee-crisis/"" rel=""nofollow"">South Sudan civil war causes Africa’s worst refugee crisis</a> appeared first on <a href=""http://www.pbs.org/newshour"" rel=""nofollow"">PBS NewsHour</a>.</p>",,http://www.pbs.org/newshour/bb/south-sudan-civil-war-causes-africas-worst-refugee-crisis/,Others
