id,title,content,published_at,source_url,category
203,Political storm: Back-to-back hurricanes rock Harris-Trump presidential campaign,"<p><a href=""https://www.foxnews.com/category/person/joe-biden"" rel=""noopener"" target=""_blank"">President Biden</a> made calls with elected officials in Florida on Wednesday evening, as powerful and extremely dangerous Hurricane Milton crashed into the state.</p><p>The president also spoke with Democratic and Republican senators from the states hard hit by <a href=""https://www.foxnews.com/category/weather/hurricanes"" rel=""noopener"" target=""_blank"">Hurricane Helene</a>, which tore a path of destruction through the southeast nearly two weeks ago.</p><p>""I directed my team to do everything we can to save lives and help communities before, during, and after the hurricane -- the one that has just passed and this awful one that’s about to hit,"" Biden said at the end of a long day overseeing the federal response to the storms.<br /> <br />And, the president stressed that ""my most important message today is for those who are in impacted areas, please, please listen to your local authorities, follow all safety…instructions and evacuation orders. This is serious, very serious.""</p><p><a href=""https://www.foxnews.com/politics/biden-cancels-overseas-trip-milton-bears-down-florida-desantis-tells-vp-its-not-about-you-kamala"" rel=""noopener"" target=""_blank""><strong>BIDEN CANCELS OVERSEAS TRIP AS MILTON BEARS DOWN ON FLORIDA</strong></a></p><p>With less than four weeks to go until <a href=""https://www.foxnews.com/elections"" rel=""noopener"" target=""_blank"">Election Day</a> in November and Vice President Kamala Harris and former President Trump locked in a narrow margin-of-error showdown in the race to succeed Biden in the White House, and with two of the hardest-hit states from Helene — North Carolina and Georgia — among the seven key battlegrounds that will likely determine the outcome of the 2024 election, the politics of federal disaster relief are again front and center on the campaign trail.<br /><br /><a href=""https://www.foxnews.com/category/person/donald-trump"" rel=""noopener"" target=""_blank"">Trump for nearly two weeks</a> has repeatedly attacked Biden and Harris and accused them of being incompetent in steering the federal efforts in responding to the back-to-back deadly hurricanes.</p><p><a href=""https://www.foxnews.com/politics/eye-storm-hurricanes-theaten-upend-harris-trump-presidential-showdown"" rel=""noopener"" target=""_blank""><strong><u>EYE OF THE STORM: BACK-TO-BACK HURRICANES IMPACT HARRIS-TRUMP PRESIDENTIAL RACE</u></strong></a></p><p>""The worst hurricane response since Katrina,"" the former president charged on Wednesday as he pointed to the much-maligned initial federal response to Hurricane Katrina in 2005, which was heavily criticized for being slow and ineffective.</p><p>Trump, speaking at a campaign rally in battleground Pennsylvania, lobbed another political bomb at Harris, arguing that ""She just led the worst rescue operation in history in North Carolina…the worst ever, they say.""</p><p>And the former president once again made false claims that FEMA (Federal Emergency Management Agency) diverted money intended for disaster relief and spent it on undocumented migrants in the U.S. as he turned up the volume on his inflammatory rhetoric over the combustible issue of illegal immigration.</p><p>""You know where they gave the money to: illegal immigrants coming,"" Trump said as the crowd of MAGA supporters loudly booed.</p><p>Trump's attacks have continued even as top Republicans in the states impacted by the storms - including <a href=""https://www.foxnews.com/category/person/ron-desantis"" rel=""noopener"" target=""_blank"">Gov. Ron DeSantis</a> of Florida - complimented the federal assistance.</p><p><a href=""https://www.foxnews.com/category/weather"" rel=""noopener"" target=""_blank""><strong><u>CLICK HERE FOR UP-TO-DATE FOX NEWS REPORTING ON THE STORMS</u></strong></a></p><p>A couple of hours earlier, as the president and<a href=""https://www.foxnews.com/category/person/kamala-harris"" rel=""noopener"" target=""_blank""> vice president</a> received their latest briefing from FEMA and other federal agencies on storm preparations in Florida and relief efforts across the Southeast, Biden said that ""we have made available an unprecedented number of assets to deal with this crisis, and we’re going to continue to do so until the job is done.""</p><p>Biden also took aim at Trump, accusing him of leading an ""onslaught of lies.""</p><p>The president charged that the rhetoric from Trump and other Republicans was ""beyond ridiculous"" and that ""it’s got to stop.""</p><p>Harris, who in July replaced Biden atop the Democrats' 2024 ticket, had a similar message during an interview Wednesday on the Weather Channel.</p><p>""This is not a time for us to just point fingers at each other as Americans,""<a href=""https://www.foxnews.com/category/person/kamala-harris"" rel=""noopener"" target=""_blank""> Harris said.</a> ""Anybody who considers themselves to be a leader should really be in the business right now of giving people a sense of confidence that we're all working together and that we have the resources and the ability to work together on their behalf.""</p><p><a href=""https://www.foxweather.com/"" rel=""noopener"" target=""_blank""><strong><u>HEAD HERE FOR THE LATEST FOX NEWS WEATHER UPDATES ON HURRICANE MILTON</u></strong></a></p><p>But earlier this week, Harris and DeSantis traded verbal fire over whether he ignored hurricane-related calls from her.</p><p>The vice president called DeSantis ""selfish,"" and the governor accused Harris of playing ""political games.""</p><p>""Natural disasters present perils and promise for presidential hopefuls,"" longtime Republican strategist Colin Reed, a veteran of multiple GOP presidential campaigns, told Fox News.</p><p>Reed noted that ""for the incumbent, it’s an opportunity to demonstrate competence and steady leadership and prove that their government is able to function at a core level during a time of peril.""</p><p>But it doesn't always play according to the script for an incumbent president.</p><p>Then-President George H.W. Bush took a political hit over FEMA's disorganized efforts to provide relief in Florida from Hurricane Andrew, which pounded the then-key battleground state weeks before the 1992 election.</p><p>Fast-forward a decade and his son - then-President George W. Bush - enjoyed a political bounce in Florida during his 2004 re-election thanks to his aggressive response to Hurricane Charley, which hit in August of that year.</p><p>Bush was narrowly re-elected, thanks in large part to carrying the Sunshine State, but his administration's image in handling storms took a major hit the next year, over the botched response in Louisiana to Hurricane Katrina.</p><p>As he ran for re-election in 2012, then-President Barack Obama's aggressive response in dealing with Superstorm Sandy -which slammed into the Eastern Seaboard days before the election - likely boosted him to victory.</p><p>Reed argued that ""without a real role to play in the response to Helene and now Milton, Vice President Harris is betwixt and between, wary about being seen as too close to a deeply unpopular administration but also well aware that its failures will be seen as her failures and political baggage to carry the next three weeks.""</p><p><a href=""https://www.foxnews.com/elections"" rel=""noopener"" target=""_blank""><i><strong><u>Get the latest updates from the 2024 campaign trail, exclusive interviews and more at our Fox News Digital election hub</u></strong></i></a><i><strong><u>.</u></strong></i></p>",,https://www.foxnews.com/politics/political-storm-back-to-back-hurricanes-rock-harris-trump-presidential-campaign,Others
204,"Trump counters Harris media blitz by ripping Bob Woodward, Howard Stern and her hurricane briefing","<p>On one point, at least, the Kremlin has sided with Bob Woodward <a href=""https://www.foxnews.com/category/person/donald-trump"" rel=""noopener"" target=""_blank"">against former President Donald Trump</a>.</p><p>Woodward is coming out with a new book, and among its headline-making disclosures is his report on what happened when the pandemic struck, when the death toll was soaring and people could not get home testing kits for COVID-19.</p><p><a href=""https://www.foxnews.com/politics/kissy-face-sitdown-view-tougher-grilling-60-minutes-kamala-harris-finally-making-news"" rel=""noopener"" target=""_blank""><strong>FROM KISSY-FACE SITDOWN ON ‘THE VIEW’ TO A TOUGHER GRILLING ON ‘60 MINUTES,’ KAMALA HARRIS IS MAKING NEWS</strong></a></p><p>Trump, at that point in 2020, secretly sent <a href=""https://www.foxnews.com/category/world/personalities/vladimir-putin"" rel=""noopener"" target=""_blank"">Vladimir Putin</a> a number of Abbott Point of Care COVID test machines ""for his personal use.""</p><p>The Trump campaign said Woodward’s book, an advance copy of which was obtained by CNN, consisted entirely of made-up stories.</p><p>However, Kremlin spokesman Dmitri Peskov confirmed the receipt of the <a href=""https://www.foxnews.com/category/health/infectious-disease/coronavirus"" rel=""noopener"" target=""_blank"">COVID machines</a>.</p><p>""As for the tests, when the pandemic began, countries did not have enough equipment,"" Peskov said. ""And many countries then exchanged such gestures of support and sent each other shipments of various equipment they had."" </p><p>In fact, during the spring of 2020, Russia sent the Trump administration 60 tons of medical equipment.</p><p>Woodward also quotes the Russian dictator as telling Trump, ""I don’t want you to tell anybody because people will get mad at you, not me. They don’t care about me.""</p><p><a href=""https://www.foxnews.com/politics/kamala-2-0s-challenge-making-more-news-not-just-ultra-friendly-hosts"" rel=""noopener"" target=""_blank""><strong>KAMALA 2.0’S CHALLENGE? MAKING MORE NEWS, AND NOT JUST WITH ULTRA-FRIENDLY HOSTS</strong></a></p><p>However, Peskov disputed another assertion by Woodward, that Trump has stayed in touch with Putin since he left the White House, with as many as seven calls between them. ""As for the calls, that's a lie,"" Peskov said.  </p><p>In the book ""War,"" however, the Washington Post sleuth recounts a scene where Trump tells a top aide to leave the room so ""he could have what he said was a private phone call with Russian President Vladimir Putin."" Trump officials now say they are not aware of any such conversations.</p><p>The former president granted Woodward 18 taped interviews for his previous book, but they had a falling out after the veteran reporter wrote that Trump was unfit for office and was sued by his subject for releasing the recordings.</p><p>I know Woodward’s work extremely well, and while any journalist can be misled by sources, he does not make things up.</p><p>Other parts of the book deal <a href=""https://www.foxnews.com/category/person/joe-biden"" rel=""noopener"" target=""_blank"">with President Biden</a> confronting Putin about the coming invasion of Ukraine, had Vice President Kamala Harris warn a skeptical Volodomyr Zelenskyy, and – with officials assuming a 50% chance that he might use a tactical nuclear weapon against the Ukrainians, called the Kremlin boss the ""epitome of evil.""  </p><p>The president repeatedly <a href=""https://www.foxnews.com/category/person/benjamin-netanyahu"" rel=""noopener"" target=""_blank"">cursed out Israeli Prime Minister Benjamin ""Bibi"" Netanyahu</a>, calling him an ""SOB"" and, later, a ""f---ing liar"" after the Israeli prime minister invaded the crowded area called Rafah despite American pressure.</p><p><a href=""https://www.foxnews.com/politics/why-vance-easily-beat-walz-debate-softening-his-image-process"" rel=""noopener"" target=""_blank""><strong>WHY VANCE EASILY BEAT WALZ IN DEBATE, SOFTENING HIS IMAGE IN THE PROCESS</strong></a></p><p>In the statement from Trump’s spokesman, which sounds like it was dictated by the boss, Woodward is described as ""a truly demented and deranged man who suffers from a debilitating case of Trump Derangement Syndrome. Woodward is an angry, little man and is clearly upset because President Trump is successfully suing him because of the unauthorized publishing of recordings he made previously. President Trump gave him absolutely no access for this trash book that either belongs in the bargain bin of the fiction section of a discount bookstore or used as toilet tissue. Woodward is a total sleazebag who has lost it mentally, and he’s slow, lethargic, incompetent and overall a boring person with no personality.""</p><p>Why stop there?</p><p>Trump, who prides himself on being a counter-puncher, wastes little time before swinging away.</p><p>After Harris’ friendly radio interview with Howard Stern, who said it would be insanity to vote for Trump, a post appeared on Truth Social.</p><p>""BETA MALE Howard Stern made a fool of himself on his low-rated radio show when he ‘interviewed’ Lyin’ Kamala Harris, and hit her with so many SOFTBALL questions that even she was embarrassed.</p><p>""He looked like a real fool, working so hard to make a totally incompetent and ill-equipped person look as good as possible, which wasn’t very good. I dropped Howard a long time ago, like most others, and have since been credited with very good judgment!"" </p><p>Trump and Stern were, of course, once New York pals, and Trump attended his wedding. </p><p>Trump also had campaign manager Chris LaCivita take a swipe at Fox News for covering (along with other networks) a government briefing, featuring both Biden and Harris, on Hurricane Milton as the monster storm was heading toward Florida. </p><p>""@FoxNews ⁩just as bad as every other ‘cable news’ network …running literally propaganda and @KamalaHarris ⁩TV ads disguised as a news conference,"" Chris LaCivita posted on X. </p><p><a href=""https://www.foxnews.com/download"" rel=""noopener"" target=""_blank""><strong><u>CLICK HERE TO GET THE FOX NEWS APP</u></strong></a></p><p>Of course, there’s a political benefit for Harris showing that she and FEMA are working hard to prepare for the Florida storm, just as there is when Florida Gov. Ron DeSantis holds a presser on the Category 5 threat.</p><p>However, with Harris' media blitz finally making some news after weeks in which Trump has dominated the campaign coverage, this reflects his determination to insert himself into every story that surfaces, no matter how negative.</p>",,https://www.foxnews.com/politics/trump-counters-harris-media-blitz-ripping-bob-woodward-howard-stern-hurricane-briefing,Others
205,"VP Harris covers mouth, says ‘it’s a live broadcast’ after stumbling through Hurricane Milton speech","<p><a href=""https://www.foxnews.com/category/person/kamala-harris"" rel=""noopener"" target=""_blank"">Vice President Harris,</a> during a Hurricane Milton update from the Federal Emergency Management Agency (FEMA) on Wednesday, covered her mouth and appeared to tell staff she was on a live broadcast after stumbling through a speech to the people of Florida.</p><p>President Biden and Harris received a briefing from <a href=""https://www.foxnews.com/category/person/joe-biden"" rel=""noopener"" target=""_blank"">disaster relief authorities</a> on life-saving preparations for Hurricane Milton. The two also received the latest updates on the forecast and expected impacts for Florida.</p><p>While Biden attended the meeting from the White House, Harris and others attended virtually.</p><p>At one point during the briefing, Harris covered her mouth and appeared to relay a message to someone else.</p><p><a href=""https://www.foxnews.com/us/florida-trooper-rescues-dog-tied-pole-puddle-milton-heads-state-desantis-calls-owner-cruel"" rel=""noopener"" target=""_blank""><strong>FLORIDA TROOPER RESCUES DOG TIED TO POLE IN PUDDLE AS MILTON HEADS TOWARD STATE, DESANTIS CALLS OWNER ‘CRUEL’</strong></a></p><p>""It’s a live broadcast,"" she could be heard saying.</p><p>The moment came nearly 20 minutes after Harris stumbled through a speech to Floridians. She glanced down multiple times, appearing to reference notes or a script.</p><p>""To the <a href=""https://www.foxnews.com/category/us/us-regions/southeast/florida"" rel=""noopener"" target=""_blank"">people of Florida,</a> and in particular, the people of the Tampa region: We urge you to take this storm seriously,"" she said. ""As has been said before, this is a storm that is expected to be of historic proportions. And many of you, I know are tough… and you’ve ridden out these hurricanes before. This one’s going to be different.</p><p><a href=""https://www.foxnews.com/travel/hurricane-milton-evacuations-florida-what-to-pack-storm"" rel=""noopener"" target=""_blank""><strong><u>HURRICANE MILTON EVACUATIONS IN FLORIDA: WHAT TO PACK AHEAD OF THE STORM</u></strong></a></p><p>""We ask you that by every measure understand it's going to be more dangerous, more deadly and more catastrophic. So please listen to your local officials,"" Harris added. ""They know what they're talking about. They know what they're doing. And if you are told to evacuate, please evacuate immediately. Do not wait until it is too late.""</p><p>Fox News Digital reached out to Harris' office for comment on the incident, but has not yet heard back.</p><p><a href=""https://www.foxnews.com/category/weather/hurricanes"" rel=""noopener"" target=""_blank"">Hurricane Milton</a> reached Category 5 storm strength multiple times over the course of the last two days, and <a>made landfall</a> as a Category 3 storm Wednesday night in the Tampa, Florida area.</p><p>Forecasters warn that Milton could produce devastating storm surges up to 12 to 13 feet.</p>",,https://www.foxnews.com/politics/vp-harris-covers-mouth-says-its-live-broadcast-after-stumbling-through-hurricane-milton-speech,Others
206,"In Arizona speech, Vance says next president must put Americans first, slams FEMA money for migrants","<p>Sen. JD Vance, R-Ohio, rallied supporters in Tucson, <a href=""https://www.foxnews.com/category/us/us-regions/southwest/arizona"" rel=""noopener"" target=""_blank"">Arizona</a>, on Wednesday, the same day <a href=""https://www.foxnews.com/politics/early-voting-begins-california-texas-5-other-states"" rel=""noopener"" target=""_blank"">early voting</a> began in the battleground state. </p><p>The Republican vice presidential nominee's message Wednesday underscored the Trump campaign's ""America First"" agenda, insisting to rallygoers that putting Americans first is the essence of why politicians exist in the first place. </p><p>""This country ought to work for the American people and the American people first,"" <a href=""https://www.foxnews.com/category/person/jd-vance"" rel=""noopener"" target=""_blank"">Vance</a> said. ""We can have compassion for people … by all means, we ought to be compassionate. But you know who our leaders owe compassion to most and above all? It's American citizens. We ought to focus on our own people and put their interests first.""</p><p><a href=""https://www.foxnews.com/politics/arizona-begins-in-person-absentee-voting-heres-what-you-need-know"" rel=""noopener"" target=""_blank""><strong>ARIZONA BEGINS IN-PERSON AND ABSENTEE VOTING, HERE'S WHAT YOU NEED TO KNOW</strong></a></p><p>Vance pointed to the Federal Emergency Management Agency's (FEMA) administration of funds to migrants for housing and relocation purposes. The roughly $1.7 billion was approved by members on both sides of the aisle in Congress and allowed a slice of FEMA's funding to go to helping states and localities deal with the ongoing migrant crisis.</p><p>Simultaneously, FEMA's disaster relief fund, which is entirely separate from the program helping migrants, has continued to receive funding to the tune of nearly $244 billion, <a href=""https://rollcall.com/2024/10/08/analysis-digging-into-fema-spending-claims-on-the-campaign-trail/"" rel=""nofollow noopener"" target=""_blank"">ProPublica reported.</a>  </p><p>""Disaster relief ought to go to prepare and to respond to a disaster when it strikes American territory. Our government has got to focus on our citizens, put their interests first, take care of American citizens when a disaster hits,"" Vance said. ""Unfortunately, under Kamala Harris' leadership, you've got <a href=""https://www.foxnews.com/category/us/disasters/fema"" rel=""nofollow noopener"" target=""_blank"">FEMA,</a> which is doing resettlement and relocation for illegal immigration.</p><p>""FEMA should take care of American citizens when a disaster strikes. That's all it should be doing. And when Donald Trump and I are back in office, that's all it's going to do.""</p><p><a href=""https://www.foxnews.com/politics/swing-state-gop-chair-slams-biden-harris-admin-out-of-touch-key-issue"" rel=""noopener"" target=""_blank""><strong>SWING STATE GOP CHAIR SLAMS BIDEN-HARRIS ADMIN FOR BEING OUT OF TOUCH ON KEY ISSUE: ‘ABANDONED THIS COUNTRY’</strong></a></p><p>At Wednesday's rally, held at Tucson Speedway, Vance was joined by his wife, Usha; Robert O'Brien, former national security adviser under Trump; Republican National Committee Chair Michael Whatley; and Arizona GOP Chair Gina Swoboda.</p><p>Vance implored people to get out and vote early if they have to, despite past criticisms from both him and Trump about early voting. He hearkened back to 2020, when, according to Vance, people who were going to vote for Trump on Election Day could not because of unforeseen circumstances.</p><p><a href=""https://www.foxnews.com/politics/new-poll-which-voter-group-fueling-trump-narrow-edge-over-harris-battleground"" rel=""noopener"" target=""_blank""><strong>NEW POLL REVEALS WHICH VOTER GROUP ARE FUELING TRUMP TO A NARROW EDGE OVER HARRIS IN BATTLEGROUND</strong></a>  </p><p>""I don't like election season. I like Election Day. But we are where we are, my friends,"" Vance said. ""We've got an election season, and if the Democrats are taking advantage of it, we've got to do the exact same thing. So whether you're voting on Election Day, or voting by mail or voting early, get out there and make your voice heard.</p><p>""I talked to a lot of people who planned to vote for Donald Trump in 2020, and 95 out of 100 of them actually went out and voted for Donald Trump. But you talk to the five who didn't vote for <a href=""https://www.foxnews.com/category/person/donald-trump"" rel=""nofollow noopener"" target=""_blank"">Donald Trump,</a> and it's not because they changed their mind, it's because… their kid got sick, so they had to go pick him up from school, or they worked late that night and weren't able to make it to the polls before they closed. The best way to make sure your voice is counted is to make sure it's counted early.""</p><p>A majority of states have already begun early voting by mail and in person.</p><p><a href=""https://www.foxnews.com/politics/conservative-super-pac-unleashes-7-figure-push-early-voting-key-senate-race"" rel=""nofollow noopener"" target=""_blank"">Montana has seen the largest percentage</a> of registered voters request absentee ballots. Biden won Arizona in 2020, but Trump won the state in 2016.    </p><p>Following Wednesday's rally, Vance headed to the Mesa, outside Phoenix, for a town hall hosted by the Conservative Political Action Conference. </p><p><a href=""https://www.foxnews.com/download"" rel=""noopener"" target=""_blank""><strong><u>CLICK HERE TO GET THE FOX NEWS APP</u></strong></a></p><p>Vice President Kamala Harris, the Democratic presidential nominee, will be in Phoenix on Friday. Former President Trump, the Republican nominee, will be in Prescott Valley on Sunday.</p><p>Minnesota Gov. Tim Walz, Harris' running mate, was also campaigning in Arizona on Wednesday with stops in Chandler, which is outside Phoenix, and Tucson.</p>",,https://www.foxnews.com/politics/arizona-speech-vance-next-president-americans-first-slams-fema-money-migrants,Others
