id,title,content,published_at,source_url,category
1,"Some on-air claims about Dominion Voting Systems were false, Fox News acknowledges in statement after deal is announced",No Content,19-04-2023 12:44,https://www.cnn.com/business/live-news/fox-news-dominion-trial-04-18-23/index.html,Others
2,Dominion still has pending lawsuits against election deniers such as Rudy Giuliani and Sidney Powell,No Content,,https://www.cnn.com/business/live-news/fox-news-dominion-trial-04-18-23/h_8d51e3ae2714edaa0dace837305d03b8,Others
3,Here are the 20 specific Fox broadcasts and tweets Dominion says were defamatory,No Content,17-04-2023 16:01,https://www.cnn.com/2023/04/17/media/dominion-fox-news-allegations/index.html,Others
4,Judge in Fox News-Dominion defamation trial: 'The parties have resolved their case',No Content,19-04-2023 08:28,https://www.cnn.com/2023/04/18/media/fox-dominion-settlement/index.html,Others
5,'Difficult to say with a straight face': Tapper reacts to Fox News' statement on settlement,No Content,18-04-2023 21:17,https://www.cnn.com/videos/politics/2023/04/18/jake-tapper-dominion-lawsuit-settlement-fox-news-statement-lead-vpx.cnn,Others
6,Millions in the US could face massive consequences unless McCarthy can navigate out of a debt trap he set for Biden,No Content,18-04-2023 20:34,https://www.cnn.com/2023/04/18/politics/mccarthy-biden-debt-ceiling/index.html,Others
7,White homeowner accused of shooting a Black teen who rang his doorbell turns himself in to face criminal charges,No Content,19-04-2023 04:29,https://www.cnn.com/2023/04/18/us/kansas-city-ralph-yarl-shooting-tuesday/index.html,Others
8,Newly released video shows scene of Jeremy Renner's snowplow accident,No Content,18-04-2023 14:09,https://www.cnn.com/videos/us/2023/04/18/jeremy-renner-snowplow-accident-bodycam-nc-melas-contd-vpx.cnn,Others
9,Jake Gyllenhaal and Jamie Lee Curtis spent the Covid-19 lockdown together,No Content,18-04-2023 14:40,https://www.cnn.com/2023/04/18/entertainment/jake-gyllenhaal-jamie-lee-curtis-pandemic-living/index.html,Others
10,"Toddler crawls through White House fence, prompts Secret Service response",No Content,18-04-2023 17:38,https://www.cnn.com/2023/04/18/politics/white-house-toddler/index.html,Others
11,Jamie Foxx remains hospitalized nearly a week after 'medical complication',No Content,18-04-2023 00:27,https://www.cnn.com/2023/04/17/entertainment/jamie-foxx-remains-hospitalized/index.html,Others
12,A 13-year-old dies after participating in a Benadryl TikTok 'challenge',No Content,19-04-2023 15:01,https://www.cnn.com/2023/04/18/us/benadryl-tiktok-challenge-teen-death-wellness/index.html,Others
13,See pizza delivery guy take out suspect fleeing police,No Content,18-04-2023 16:40,https://www.cnn.com/videos/us/2023/04/18/pizza-guy-trips-perp-moos-cprog-orig-bdk.cnn,Others
14,Netflix is winding down its DVD business after 25 years,No Content,18-04-2023 20:10,https://www.cnn.com/2023/04/18/media/netflix-dvd-red-envelopes/index.html,Others
15,FTC chair Lina Khan warns AI could 'turbocharge' fraud and scams,No Content,18-04-2023 17:59,https://www.cnn.com/2023/04/18/tech/lina-khan-ai-warning/index.html,Others
16,"Eating too much of these foods is driving the rise in type 2 diabetes, study says",No Content,17-04-2023 16:02,https://www.cnn.com/2023/04/17/health/rise-type-2-diabetes-global-wellness/index.html,Others
17,ADHD medication abuse in schools is a 'wake-up call',No Content,25-04-2023 17:44,https://www.cnn.com/2023/04/18/health/teen-misuse-adhd-meds-wellness/index.html,Others
18,Apple CEO was presented with an original Macintosh. See his reaction,No Content,18-04-2023 09:17,https://www.cnn.com/videos/tech/2023/04/18/apple-store-mumbai-india-ceo-tim-cook-vedika-sud-ovn-biz-ldn-vpx.cnn,Others
19,Democrats bash Justice Clarence Thomas but their plan to investigate ethics allegations is unclear,No Content,18-04-2023 20:29,https://www.cnn.com/2023/04/18/politics/clarence-thomas-ethics-democrats/index.html,Others
20,"Russia is 'going backwards' in equipment and deploying post WWII-era tanks, according to Western officials",No Content,,https://www.cnn.com/europe/live-news/russia-ukraine-war-news-04-18-23/index.html,Others
21,Two Russians claiming to be former Wagner commanders admit killing children and civilians in Ukraine,No Content,18-04-2023 19:07,https://www.cnn.com/2023/04/17/europe/wagner-commanders-russia-kill-children-intl-hnk/index.html,Others
22,'My stomach is hurting from laughing': Hear panelist's reaction to DeSantis' threat to Disney,No Content,18-04-2023 03:24,https://www.cnn.com/videos/business/2023/04/18/desantis-disney-competition-panel-reax-pt-vpx.cnn,Others
23,GOP prepared to block vote to replace Feinstein on Senate Judiciary,No Content,18-04-2023 22:03,https://www.cnn.com/2023/04/18/politics/schumer-senate-feinstein-vote-cardin/index.html,Others
24,Oklahoma governor calls on officials to resign over recording of racist and threatening remarks,No Content,18-04-2023 17:33,https://www.cnn.com/2023/04/18/us/mccurtain-county-oklahoma-officials-recording/index.html,Others
25,McCarthy slams Biden in handling of US debt,No Content,18-04-2023 22:03,https://www.cnn.com/videos/politics/2023/04/18/kevin-mccarthy-wall-street-speech-debt-ceiling-biden-economy-vpx.cnn,Others
26,US warns Russia not to touch American nuclear technology at Ukrainian nuclear plant,No Content,19-04-2023 08:35,https://www.cnn.com/2023/04/18/politics/us-warns-russia-zaporizhzhia-nuclear-plant/index.html,Others
27,Repeated gunshots fired on live TV as ex-lawmaker shot by assassins,No Content,18-04-2023 09:41,https://www.cnn.com/videos/world/2023/04/18/india-ex-lawmaker-atiq-ahmed-assassination-sud-pkg-contd-ovn-intl-hnk-vpx.cnn,Others
28,FDA clears the way for additional bivalent boosters for certain vulnerable individuals,No Content,18-04-2023 15:09,https://www.cnn.com/2023/04/18/health/fda-bivalent-booster-additional-doses/index.html,Others
29,Maine authorities detained a person of interest after 4 people were found dead in a home and 3 others shot while driving,No Content,19-04-2023 01:49,https://www.cnn.com/2023/04/18/us/maine-shooting-bowdoin-yarmouth/index.html,Others
30,Southwest says flights resumed after delays caused by 'tech issues',No Content,18-04-2023 17:15,https://www.cnn.com/travel/article/southwest-airlines-flight-delays/index.html,Others
31,Damar Hamlin cleared to resume football activities after January cardiac arrest,No Content,18-04-2023 22:11,https://www.cnn.com/2023/04/18/sport/damar-hamlin-cleared-to-train-nfl-spt-intl/index.html,Others
32,Pilot makes history after landing on top of a 56-story hotel,No Content,19-03-2023 11:22,https://www.cnn.com/videos/travel/2023/03/17/pilot-lands-on-dubai-helipad-cprog-orig-aw-ao.cnn,Others
33,Top US Navy admiral defends non-binary sailor amid some Republican criticism,No Content,18-04-2023 19:56,https://www.cnn.com/2023/04/18/politics/gilday-defends-non-binary-sailor/index.html,Others
34,Fulton County DA says fake Trump electors are incriminating one another and wants lawyer disqualified,No Content,19-04-2023 15:31,https://www.cnn.com/2023/04/18/politics/fulton-county-trump-fake-electors/index.html,Others
35,High speed trains are racing across the world. But not in America,No Content,19-04-2023 02:39,https://www.cnn.com/travel/article/high-speed-rail-us/index.html,Others
36,Podcast: One country musician is calling for other artists to oppose assault rifles,No Content,,https://www.cnn.com/audio/podcasts/the-assignment/episodes/42a2f0e2-066a-4675-82ff-afe2016a0bb5,Others
37,Here's what you need to know if you haven't filed your return yet — and even if you have,No Content,18-04-2023 14:15,https://www.cnn.com/2023/04/18/success/tax-day-2023-file-irs/index.html,Others
38,"Undocumented immigrants are paying their taxes today, too",No Content,18-04-2023 18:29,https://www.cnn.com/2023/04/18/us/undocumented-immigrants-taxes-cec/index.html,Others
39,Opinion: Why millionaires like us want to pay more in taxes,No Content,17-04-2023 19:32,https://www.cnn.com/2023/04/17/opinions/us-tax-system-wealthy-disney-pearl/index.html,Others
40,'World's longest' purpose-built cycling tunnel opens in Norway,No Content,18-04-2023 10:44,https://www.cnn.com/travel/article/worlds-longest-cycling-tunnel/index.html,Others
41,Artist rejects photo prize after AI-generated image wins award,No Content,18-04-2023 15:27,https://www.cnn.com/style/article/ai-photo-win-sony-scli-intl/index.html,Others
42,These ships disappeared in Lake Superior a century ago. Watch as they're found again,No Content,18-04-2023 19:29,https://www.cnn.com/videos/travel/2023/04/18/century-old-shipwrecks-lake-superior-discovery-contd-orig-zt.cnn,Others
43,Erotic images of seniors show sex and intimacy in new light,No Content,18-04-2023 03:24,https://www.cnn.com/style/article/marilyn-minter-artist-elder-sex/index.html,Others
44,"China's economy is off to a solid start, rising 4.5% in Q1 2023",No Content,18-04-2023 07:01,https://www.cnn.com/2023/04/17/economy/china-gdp-q1-2023-intl-hnk/index.html,Others
45,"Even when wives make as much as husbands, they still do more at home",No Content,16-04-2023 17:29,https://www.cnn.com/2023/04/16/success/husbands-wives-earning-division-of-labor-pew-survey/index.html,Others
46,McDonald's is upgrading its burgers,No Content,17-04-2023 16:31,https://www.cnn.com/2023/04/17/business/mcdonalds-burgers/index.html,Others
47,Google-parent stock drops on fears it could lose search market share to AI-powered rivals,No Content,17-04-2023 15:52,https://www.cnn.com/2023/04/17/tech/google-ai-search-engine-stock-drop/index.html,Others
48,Bidets save you money and reduce waste — we tested the best options out there,No Content,,https://www.cnn.com/cnn-underscored/reviews/best-bidets?iid=CNNUnderscoredHPcontainer,Others
49,50+ products to make your life easier and our planet cleaner,No Content,,https://www.cnn.com/cnn-underscored/home/editors-favorite-sustainable-products?iid=CNNUnderscoredHPcontainer,Others
50,Mother's Day is around the corner. Here are 50+ thoughtful gifts she'll love,No Content,,https://www.cnn.com/cnn-underscored/gifts/best-mothers-day-gifts-2023?iid=CNNUnderscoredHPcontainer,Others
51,"A head-to-toe guide of how men should dress this spring, and where they should shop",No Content,,https://www.cnn.com/cnn-underscored/fashion/mens-spring-fashion-style-guide?iid=CNNUnderscoredHPcontainer,Others
52,42 of the most useful travel products you can buy on Amazon,No Content,,https://www.cnn.com/cnn-underscored/travel/amazon-travel-products?iid=CNNUnderscoredHPcontainer,Others
53,The 7 best high-yield savings accounts of April 2023,No Content,,https://www.cnn.com/cnn-underscored/money/high-yield-savings-accounts?iid=CNNUnderscoredHPcontainer,Others
54,Taxes are due tomorrow. Here's how to file for an extension,No Content,,https://www.cnn.com/cnn-underscored/money/how-to-file-taxes?iid=CNNUnderscoredHPcontainer,Others
55,Composting is an easy way to reduce food waste. Here's how to do it,No Content,,https://www.cnn.com/cnn-underscored/home/how-to-compost-at-home?iid=CNNUnderscoredHPcontainer,Others
56,We stopped using aluminum foil for cooking and you should too. Here's what to use instead,No Content,,https://www.cnn.com/cnn-underscored/reviews/mmmat-silicone-mats?iid=CNNUnderscoredHPcontainer,Others
57,The beloved Dyson Supersonic hair dryer is at its lowest price ever,No Content,,https://www.cnn.com/cnn-underscored/deals/dyson-supersonic-sale-2023-04-17?iid=CNNUnderscoredHPcontainer?iid=CNNUnderscoredHPcontainer,Others
58,"Everything you need to know about Way Day 2023, Wayfair's biggest sale of the year",No Content,,https://www.cnn.com/cnn-underscored/deals/wayfair-way-day-2023-04-17?iid=CNNUnderscoredHPcontainer,Others
59,The 10 best Amazon deals to shop this week,No Content,,https://www.cnn.com/cnn-underscored/deals/best-amazon-deals-2023-04-12?iid=CNNUnderscoredHPcontainer,Others
60,Mifepristone saved my life,No Content,18-04-2023 11:30,https://www.cnn.com/2023/04/18/opinions/medication-abortion-mifepristone-miscarriage-jones-ctpr/index.html,Others
61,The 2024 presidential alternative many voters will want,No Content,,https://www.cnn.com/2023/04/18/opinions/2024-presidential-election-alternative-voters-lieberman,Others
62,Why isn't the House Judiciary Committee looking into Thomas?,No Content,17-04-2023 11:37,https://www.cnn.com/2023/04/17/opinions/jim-jordan-clarence-thomas-judiciary-committee-obeidallah/index.html,Others
63,Top secrets come spilling out,No Content,16-04-2023 11:22,https://www.cnn.com/2023/04/16/opinions/top-secrets-come-spilling-out-opinion-column-galant/index.html,Others
64,How did Sudan go from casting off despotic rule to this?,No Content,17-04-2023 22:45,https://www.cnn.com/2023/04/17/opinions/sudan-revolution-to-civil-war-lynch/index.html,Others
65,Michelle Yeoh set to return in new 'Star Trek' movie,No Content,18-04-2023 19:11,https://www.cnn.com/2023/04/18/entertainment/michelle-yeoh-star-trek-section-31/index.html,Others
66,Recap: 'Succession' finds dark humor in the aftershocks,No Content,17-04-2023 02:28,https://www.cnn.com/2023/04/16/entertainment/succession-season-4-episode-4-recap/index.html,Others
67,"'Yellowjackets' leans hard into '90s music nostalgia, and we're here for it",No Content,01-05-2023 23:02,https://www.cnn.com/2023/04/14/entertainment/yellowjackets-90s-music/index.html,Others
68,Jeremy Renner revisits 'the amazing group of people' who helped him recover from his accident,No Content,16-04-2023 19:04,https://www.cnn.com/2023/04/16/entertainment/jeremy-renner-update/index.html,Others
69,Review: 'Barry' takes a whack at its farewell season,No Content,14-04-2023 12:33,https://www.cnn.com/2023/04/14/entertainment/barry-season-4-review/index.html,Others
70,"Some on-air claims about Dominion Voting Systems were false, Fox News acknowledges in statement after deal is announced",No Content,19-04-2023 12:44,https://www.cnn.com/business/live-news/fox-news-dominion-trial-04-18-23/index.html,Others
71,Dominion still has pending lawsuits against election deniers such as Rudy Giuliani and Sidney Powell,No Content,,https://www.cnn.com/business/live-news/fox-news-dominion-trial-04-18-23/h_8d51e3ae2714edaa0dace837305d03b8,Others
72,Here are the 20 specific Fox broadcasts and tweets Dominion says were defamatory,No Content,17-04-2023 16:01,https://www.cnn.com/2023/04/17/media/dominion-fox-news-allegations/index.html,Others
73,Judge in Fox News-Dominion defamation trial: 'The parties have resolved their case',No Content,19-04-2023 08:28,https://www.cnn.com/2023/04/18/media/fox-dominion-settlement/index.html,Others
74,'Difficult to say with a straight face': Tapper reacts to Fox News' statement on settlement,No Content,18-04-2023 21:17,https://www.cnn.com/videos/politics/2023/04/18/jake-tapper-dominion-lawsuit-settlement-fox-news-statement-lead-vpx.cnn,Others
75,Millions in the US could face massive consequences unless McCarthy can navigate out of a debt trap he set for Biden,No Content,18-04-2023 20:34,https://www.cnn.com/2023/04/18/politics/mccarthy-biden-debt-ceiling/index.html,Others
76,White homeowner accused of shooting a Black teen who rang his doorbell turns himself in to face criminal charges,No Content,19-04-2023 04:29,https://www.cnn.com/2023/04/18/us/kansas-city-ralph-yarl-shooting-tuesday/index.html,Others
77,Newly released video shows scene of Jeremy Renner's snowplow accident,No Content,18-04-2023 14:09,https://www.cnn.com/videos/us/2023/04/18/jeremy-renner-snowplow-accident-bodycam-nc-melas-contd-vpx.cnn,Others
78,Jake Gyllenhaal and Jamie Lee Curtis spent the Covid-19 lockdown together,No Content,18-04-2023 14:40,https://www.cnn.com/2023/04/18/entertainment/jake-gyllenhaal-jamie-lee-curtis-pandemic-living/index.html,Others
79,"Toddler crawls through White House fence, prompts Secret Service response",No Content,18-04-2023 17:38,https://www.cnn.com/2023/04/18/politics/white-house-toddler/index.html,Others
80,Jamie Foxx remains hospitalized nearly a week after 'medical complication',No Content,18-04-2023 00:27,https://www.cnn.com/2023/04/17/entertainment/jamie-foxx-remains-hospitalized/index.html,Others
81,A 13-year-old dies after participating in a Benadryl TikTok 'challenge',No Content,19-04-2023 15:01,https://www.cnn.com/2023/04/18/us/benadryl-tiktok-challenge-teen-death-wellness/index.html,Others
82,See pizza delivery guy take out suspect fleeing police,No Content,18-04-2023 16:40,https://www.cnn.com/videos/us/2023/04/18/pizza-guy-trips-perp-moos-cprog-orig-bdk.cnn,Others
83,Netflix is winding down its DVD business after 25 years,No Content,18-04-2023 20:10,https://www.cnn.com/2023/04/18/media/netflix-dvd-red-envelopes/index.html,Others
84,FTC chair Lina Khan warns AI could 'turbocharge' fraud and scams,No Content,18-04-2023 17:59,https://www.cnn.com/2023/04/18/tech/lina-khan-ai-warning/index.html,Others
85,"Eating too much of these foods is driving the rise in type 2 diabetes, study says",No Content,17-04-2023 16:02,https://www.cnn.com/2023/04/17/health/rise-type-2-diabetes-global-wellness/index.html,Others
86,ADHD medication abuse in schools is a 'wake-up call',No Content,25-04-2023 17:44,https://www.cnn.com/2023/04/18/health/teen-misuse-adhd-meds-wellness/index.html,Others
87,Apple CEO was presented with an original Macintosh. See his reaction,No Content,18-04-2023 09:17,https://www.cnn.com/videos/tech/2023/04/18/apple-store-mumbai-india-ceo-tim-cook-vedika-sud-ovn-biz-ldn-vpx.cnn,Others
88,Democrats bash Justice Clarence Thomas but their plan to investigate ethics allegations is unclear,No Content,18-04-2023 20:29,https://www.cnn.com/2023/04/18/politics/clarence-thomas-ethics-democrats/index.html,Others
89,"Russia is 'going backwards' in equipment and deploying post WWII-era tanks, according to Western officials",No Content,,https://www.cnn.com/europe/live-news/russia-ukraine-war-news-04-18-23/index.html,Others
90,Two Russians claiming to be former Wagner commanders admit killing children and civilians in Ukraine,No Content,18-04-2023 19:07,https://www.cnn.com/2023/04/17/europe/wagner-commanders-russia-kill-children-intl-hnk/index.html,Others
91,'My stomach is hurting from laughing': Hear panelist's reaction to DeSantis' threat to Disney,No Content,18-04-2023 03:24,https://www.cnn.com/videos/business/2023/04/18/desantis-disney-competition-panel-reax-pt-vpx.cnn,Others
92,GOP prepared to block vote to replace Feinstein on Senate Judiciary,No Content,18-04-2023 22:03,https://www.cnn.com/2023/04/18/politics/schumer-senate-feinstein-vote-cardin/index.html,Others
93,Oklahoma governor calls on officials to resign over recording of racist and threatening remarks,No Content,18-04-2023 17:33,https://www.cnn.com/2023/04/18/us/mccurtain-county-oklahoma-officials-recording/index.html,Others
94,McCarthy slams Biden in handling of US debt,No Content,18-04-2023 22:03,https://www.cnn.com/videos/politics/2023/04/18/kevin-mccarthy-wall-street-speech-debt-ceiling-biden-economy-vpx.cnn,Others
95,US warns Russia not to touch American nuclear technology at Ukrainian nuclear plant,No Content,19-04-2023 08:35,https://www.cnn.com/2023/04/18/politics/us-warns-russia-zaporizhzhia-nuclear-plant/index.html,Others
96,Repeated gunshots fired on live TV as ex-lawmaker shot by assassins,No Content,18-04-2023 09:41,https://www.cnn.com/videos/world/2023/04/18/india-ex-lawmaker-atiq-ahmed-assassination-sud-pkg-contd-ovn-intl-hnk-vpx.cnn,Others
97,FDA clears the way for additional bivalent boosters for certain vulnerable individuals,No Content,18-04-2023 15:09,https://www.cnn.com/2023/04/18/health/fda-bivalent-booster-additional-doses/index.html,Others
98,Maine authorities detained a person of interest after 4 people were found dead in a home and 3 others shot while driving,No Content,19-04-2023 01:49,https://www.cnn.com/2023/04/18/us/maine-shooting-bowdoin-yarmouth/index.html,Others
99,Southwest says flights resumed after delays caused by 'tech issues',No Content,18-04-2023 17:15,https://www.cnn.com/travel/article/southwest-airlines-flight-delays/index.html,Others
100,Damar Hamlin cleared to resume football activities after January cardiac arrest,No Content,18-04-2023 22:11,https://www.cnn.com/2023/04/18/sport/damar-hamlin-cleared-to-train-nfl-spt-intl/index.html,Others
101,Pilot makes history after landing on top of a 56-story hotel,No Content,19-03-2023 11:22,https://www.cnn.com/videos/travel/2023/03/17/pilot-lands-on-dubai-helipad-cprog-orig-aw-ao.cnn,Others
102,Top US Navy admiral defends non-binary sailor amid some Republican criticism,No Content,18-04-2023 19:56,https://www.cnn.com/2023/04/18/politics/gilday-defends-non-binary-sailor/index.html,Others
103,Fulton County DA says fake Trump electors are incriminating one another and wants lawyer disqualified,No Content,19-04-2023 15:31,https://www.cnn.com/2023/04/18/politics/fulton-county-trump-fake-electors/index.html,Others
104,High speed trains are racing across the world. But not in America,No Content,19-04-2023 02:39,https://www.cnn.com/travel/article/high-speed-rail-us/index.html,Others
105,Podcast: One country musician is calling for other artists to oppose assault rifles,No Content,,https://www.cnn.com/audio/podcasts/the-assignment/episodes/42a2f0e2-066a-4675-82ff-afe2016a0bb5,Others
230,"Obituary: Ratan Tata, the 'modest' Indian tycoon",No Content,09-10-2024 19:40,https://www.bbc.com/news/articles/cd11lz4vpr7o,Others
106,Here's what you need to know if you haven't filed your return yet — and even if you have,No Content,18-04-2023 14:15,https://www.cnn.com/2023/04/18/success/tax-day-2023-file-irs/index.html,Others
107,"Undocumented immigrants are paying their taxes today, too",No Content,18-04-2023 18:29,https://www.cnn.com/2023/04/18/us/undocumented-immigrants-taxes-cec/index.html,Others
108,Opinion: Why millionaires like us want to pay more in taxes,No Content,17-04-2023 19:32,https://www.cnn.com/2023/04/17/opinions/us-tax-system-wealthy-disney-pearl/index.html,Others
109,'World's longest' purpose-built cycling tunnel opens in Norway,No Content,18-04-2023 10:44,https://www.cnn.com/travel/article/worlds-longest-cycling-tunnel/index.html,Others
110,Artist rejects photo prize after AI-generated image wins award,No Content,18-04-2023 15:27,https://www.cnn.com/style/article/ai-photo-win-sony-scli-intl/index.html,Others
111,These ships disappeared in Lake Superior a century ago. Watch as they're found again,No Content,18-04-2023 19:29,https://www.cnn.com/videos/travel/2023/04/18/century-old-shipwrecks-lake-superior-discovery-contd-orig-zt.cnn,Others
112,Erotic images of seniors show sex and intimacy in new light,No Content,18-04-2023 03:24,https://www.cnn.com/style/article/marilyn-minter-artist-elder-sex/index.html,Others
113,"China's economy is off to a solid start, rising 4.5% in Q1 2023",No Content,18-04-2023 07:01,https://www.cnn.com/2023/04/17/economy/china-gdp-q1-2023-intl-hnk/index.html,Others
114,"Even when wives make as much as husbands, they still do more at home",No Content,16-04-2023 17:29,https://www.cnn.com/2023/04/16/success/husbands-wives-earning-division-of-labor-pew-survey/index.html,Others
115,McDonald's is upgrading its burgers,No Content,17-04-2023 16:31,https://www.cnn.com/2023/04/17/business/mcdonalds-burgers/index.html,Others
116,Google-parent stock drops on fears it could lose search market share to AI-powered rivals,No Content,17-04-2023 15:52,https://www.cnn.com/2023/04/17/tech/google-ai-search-engine-stock-drop/index.html,Others
117,Bidets save you money and reduce waste — we tested the best options out there,No Content,,https://www.cnn.com/cnn-underscored/reviews/best-bidets?iid=CNNUnderscoredHPcontainer,Others
118,50+ products to make your life easier and our planet cleaner,No Content,,https://www.cnn.com/cnn-underscored/home/editors-favorite-sustainable-products?iid=CNNUnderscoredHPcontainer,Others
119,Mother's Day is around the corner. Here are 50+ thoughtful gifts she'll love,No Content,,https://www.cnn.com/cnn-underscored/gifts/best-mothers-day-gifts-2023?iid=CNNUnderscoredHPcontainer,Others
120,"A head-to-toe guide of how men should dress this spring, and where they should shop",No Content,,https://www.cnn.com/cnn-underscored/fashion/mens-spring-fashion-style-guide?iid=CNNUnderscoredHPcontainer,Others
121,42 of the most useful travel products you can buy on Amazon,No Content,,https://www.cnn.com/cnn-underscored/travel/amazon-travel-products?iid=CNNUnderscoredHPcontainer,Others
122,The 7 best high-yield savings accounts of April 2023,No Content,,https://www.cnn.com/cnn-underscored/money/high-yield-savings-accounts?iid=CNNUnderscoredHPcontainer,Others
123,Taxes are due tomorrow. Here's how to file for an extension,No Content,,https://www.cnn.com/cnn-underscored/money/how-to-file-taxes?iid=CNNUnderscoredHPcontainer,Others
124,Composting is an easy way to reduce food waste. Here's how to do it,No Content,,https://www.cnn.com/cnn-underscored/home/how-to-compost-at-home?iid=CNNUnderscoredHPcontainer,Others
125,We stopped using aluminum foil for cooking and you should too. Here's what to use instead,No Content,,https://www.cnn.com/cnn-underscored/reviews/mmmat-silicone-mats?iid=CNNUnderscoredHPcontainer,Others
126,The beloved Dyson Supersonic hair dryer is at its lowest price ever,No Content,,https://www.cnn.com/cnn-underscored/deals/dyson-supersonic-sale-2023-04-17?iid=CNNUnderscoredHPcontainer?iid=CNNUnderscoredHPcontainer,Others
127,"Everything you need to know about Way Day 2023, Wayfair's biggest sale of the year",No Content,,https://www.cnn.com/cnn-underscored/deals/wayfair-way-day-2023-04-17?iid=CNNUnderscoredHPcontainer,Others
128,The 10 best Amazon deals to shop this week,No Content,,https://www.cnn.com/cnn-underscored/deals/best-amazon-deals-2023-04-12?iid=CNNUnderscoredHPcontainer,Others
